{
  "schema_version": 1,
  "id": "scene.signal_town_big",
  "camera": {
    "offset_m": [
      -7.0,
      -8.1,
      8.8
    ],
    "target_height_m": 0.45,
    "fov_degrees": 41.0,
    "focus_weights": {
      "robot": 0.52,
      "actor": 0.3,
      "goal": 0.18
    },
    "event_shot": {
      "offset_m": [
        -6.7,
        -7.7,
        8.0
      ],
      "target_height_m": 0.4,
      "fov_degrees": 38.0,
      "focus_weights": {
        "robot": 0.54,
        "actor": 0.46,
        "goal": 0.0
      }
    },
    "success_shot": {
      "offset_m": [
        -5.2,
        -6.0,
        5.8
      ],
      "target_height_m": 0.52,
      "fov_degrees": 37.0,
      "focus_weights": {
        "robot": 0.48,
        "actor": 0.0,
        "goal": 0.52
      }
    },
    "transition_s": 0.65
  },
  "lighting": {
    "direction": [
      -0.48,
      0.32,
      -1.0
    ],
    "directional_color": "#D8F4FF",
    "directional_intensity": 1.18,
    "ambient_color": "#2A3F4A",
    "fog_color": "#0A1420",
    "fog_start_m": 12.0,
    "fog_end_m": 31.0,
    "robot_active_color": "#17E6C8",
    "robot_waiting_color": "#B85C14",
    "goal_color": "#B14AFF",
    "shadow_map_resolution": 2048,
    "shadow_extent_m": 27.0,
    "shadow_strength": 0.62,
    "exposure": 1.0,
    "bloom_threshold": 0.7,
    "bloom_strength": 0.35,
    "vignette_strength": 0.18
  },
  "floor": {
    "base_color": "#181C1B",
    "tile_color": "#595A54",
    "boundary_color": "#2E302E",
    "tile_size_m": 4.0,
    "seam_m": 0.015,
    "color_variation": 9,
    "boundary_height_m": 0.24,
    "boundary_width_m": 0.22,
    "albedo_texture": "textures/environment/concrete_floor.png"
  },
  "prefabs": [
    {
      "id": "prefab.wall_panel",
      "parts": [
        {
          "model_3d": "models/environment/research_base/wall_panel.glb",
          "position_m": [
            0,
            0,
            0
          ],
          "size_m": [
            1,
            1,
            1
          ],
          "color": "#FFFFFF"
        }
      ]
    },
    {
      "id": "prefab.rubble_cluster",
      "parts": [
        {
          "model_3d": "models/environment/research_base/rubble_cluster.glb",
          "position_m": [
            0,
            0,
            0
          ],
          "size_m": [
            1,
            1,
            1
          ],
          "color": "#FFFFFF"
        }
      ]
    },
    {
      "id": "prefab.plant_cluster",
      "parts": [
        {
          "model_3d": "models/environment/research_base/plant_cluster.glb",
          "position_m": [
            0,
            0,
            0
          ],
          "size_m": [
            1,
            1,
            1
          ],
          "color": "#FFFFFF"
        }
      ]
    },
    {
      "id": "prefab.service_light",
      "parts": [
        {
          "model_3d": "models/environment/research_base/service_light.glb",
          "position_m": [
            0,
            0,
            0
          ],
          "size_m": [
            1,
            1,
            1
          ],
          "color": "#FFFFFF"
        }
      ]
    },
    {
      "id": "prefab.control_console",
      "parts": [
        {
          "model_3d": "models/environment/research_base/control_console.glb",
          "position_m": [
            0,
            0,
            0
          ],
          "size_m": [
            1,
            1,
            1
          ],
          "color": "#FFFFFF"
        }
      ]
    },
    {
      "id": "prefab.cable_reel",
      "parts": [
        {
          "model_3d": "models/environment/research_base/cable_reel.glb",
          "position_m": [
            0,
            0,
            0
          ],
          "size_m": [
            1,
            1,
            1
          ],
          "color": "#FFFFFF"
        }
      ]
    },
    {
      "id": "prefab.maintenance_crates",
      "parts": [
        {
          "model_3d": "models/environment/research_base/maintenance_crates.glb",
          "position_m": [
            0,
            0,
            0
          ],
          "size_m": [
            1,
            1,
            1
          ],
          "color": "#FFFFFF"
        }
      ]
    },
    {
      "id": "prefab.warning_strip",
      "parts": [
        {
          "model_3d": "models/environment/research_base/warning_strip.glb",
          "position_m": [
            0,
            0,
            0
          ],
          "size_m": [
            1,
            1,
            1
          ],
          "color": "#FFFFFF"
        }
      ]
    }
  ],
  "instances": [
    {
      "id": "bwall_n_01",
      "prefab": "prefab.wall_panel",
      "position_m": [
        6.0,
        32.18,
        0
      ],
      "scale": [
        1.0,
        1.0,
        1.0
      ]
    },
    {
      "id": "bwall_n_02",
      "prefab": "prefab.wall_panel",
      "position_m": [
        16.0,
        32.18,
        0
      ],
      "scale": [
        1.0,
        1.0,
        1.0
      ]
    },
    {
      "id": "bwall_n_03",
      "prefab": "prefab.wall_panel",
      "position_m": [
        26.0,
        32.18,
        0
      ],
      "scale": [
        1.0,
        1.0,
        1.0
      ]
    },
    {
      "id": "bwall_n_04",
      "prefab": "prefab.wall_panel",
      "position_m": [
        36.0,
        32.18,
        0
      ],
      "scale": [
        1.0,
        1.0,
        1.0
      ]
    },
    {
      "id": "bwall_n_05",
      "prefab": "prefab.wall_panel",
      "position_m": [
        44.0,
        32.18,
        0
      ],
      "scale": [
        1.0,
        1.0,
        1.0
      ]
    },
    {
      "id": "bwall_e_01",
      "prefab": "prefab.wall_panel",
      "position_m": [
        48.18,
        8.0,
        0
      ],
      "yaw_degrees": 90,
      "scale": [
        1.0,
        1.0,
        1.0
      ]
    },
    {
      "id": "bwall_e_02",
      "prefab": "prefab.wall_panel",
      "position_m": [
        48.18,
        16.0,
        0
      ],
      "yaw_degrees": 90,
      "scale": [
        1.0,
        1.0,
        1.0
      ]
    },
    {
      "id": "bwall_e_03",
      "prefab": "prefab.wall_panel",
      "position_m": [
        48.18,
        24.0,
        0
      ],
      "yaw_degrees": 90,
      "scale": [
        1.0,
        1.0,
        1.0
      ]
    },
    {
      "id": "bwh_crates_01",
      "prefab": "prefab.maintenance_crates",
      "position_m": [
        4.0,
        27.0,
        0
      ],
      "yaw_degrees": 10,
      "scale": [
        1.0,
        1.0,
        1.0
      ]
    },
    {
      "id": "bwh_crates_02",
      "prefab": "prefab.maintenance_crates",
      "position_m": [
        15.0,
        22.0,
        0
      ],
      "yaw_degrees": -8,
      "scale": [
        1.0,
        1.0,
        1.0
      ]
    },
    {
      "id": "bwh_reel_01",
      "prefab": "prefab.cable_reel",
      "position_m": [
        7.0,
        24.0,
        0
      ],
      "yaw_degrees": 40,
      "scale": [
        1.0,
        1.0,
        1.0
      ]
    },
    {
      "id": "ben_console_01",
      "prefab": "prefab.control_console",
      "position_m": [
        23.0,
        27.0,
        0
      ],
      "scale": [
        1.0,
        1.0,
        1.0
      ]
    },
    {
      "id": "ben_console_02",
      "prefab": "prefab.control_console",
      "position_m": [
        28.0,
        27.0,
        0
      ],
      "scale": [
        0.9,
        0.9,
        0.9
      ]
    },
    {
      "id": "ben_light_01",
      "prefab": "prefab.service_light",
      "position_m": [
        25.5,
        21.0,
        0
      ],
      "scale": [
        1.0,
        1.0,
        1.0
      ]
    },
    {
      "id": "bmk_crates_01",
      "prefab": "prefab.maintenance_crates",
      "position_m": [
        34.0,
        27.0,
        0
      ],
      "yaw_degrees": 90,
      "scale": [
        1.0,
        1.0,
        1.0
      ]
    },
    {
      "id": "bmk_crates_02",
      "prefab": "prefab.maintenance_crates",
      "position_m": [
        44.0,
        22.0,
        0
      ],
      "scale": [
        1.0,
        1.0,
        1.0
      ]
    },
    {
      "id": "bmk_light_01",
      "prefab": "prefab.service_light",
      "position_m": [
        36.0,
        21.0,
        0
      ],
      "scale": [
        1.0,
        1.0,
        1.0
      ]
    },
    {
      "id": "bhs_plant_01",
      "prefab": "prefab.plant_cluster",
      "position_m": [
        15.0,
        4.0,
        0
      ],
      "scale": [
        1.0,
        1.0,
        1.0
      ]
    },
    {
      "id": "bhs_plant_02",
      "prefab": "prefab.plant_cluster",
      "position_m": [
        30.0,
        9.0,
        0
      ],
      "scale": [
        0.9,
        0.9,
        0.9
      ]
    },
    {
      "id": "bhs_reel_01",
      "prefab": "prefab.cable_reel",
      "position_m": [
        27.0,
        6.0,
        0
      ],
      "yaw_degrees": 70,
      "scale": [
        1.0,
        1.0,
        1.0
      ]
    },
    {
      "id": "bdk_crates_01",
      "prefab": "prefab.maintenance_crates",
      "position_m": [
        4.0,
        12.0,
        0
      ],
      "yaw_degrees": 20,
      "scale": [
        1.0,
        1.0,
        1.0
      ]
    },
    {
      "id": "bdk_rubble_01",
      "prefab": "prefab.rubble_cluster",
      "position_m": [
        8.0,
        2.0,
        0
      ],
      "scale": [
        0.8,
        0.8,
        0.8
      ]
    },
    {
      "id": "bst_light_gate",
      "prefab": "prefab.service_light",
      "position_m": [
        2.5,
        2.5,
        0
      ],
      "scale": [
        1.0,
        1.0,
        1.0
      ]
    },
    {
      "id": "bst_light_core",
      "prefab": "prefab.service_light",
      "position_m": [
        25.5,
        19.0,
        0
      ],
      "scale": [
        1.0,
        1.0,
        1.0
      ]
    },
    {
      "id": "bst_light_market",